text,label,new_story_1,new_story_1_score,new_story_2,new_story_2_score,new_story_3,new_story_3_score
"Ah oui, oui moi c'est la texture. Je n'arrive pas à lui mélanger, c'est même plus la peine. Pour ***[nom de l’enfant] c'est de la viande, de la viande. De la purée, des légumes, elle en veut pas. Et y a rien à faire. Par exemple, hier soir elle a mangé des tenders. Vous savez c'est du poulet pané et on le mange en morceau. C'est dur. ",Food selectivity,"Lily was hungry. She wanted to eat steak. Steak was her favorite food. She saw a big steak on the table. It smelled good. She wanted to take it.

But Mom said, ""No, Lily. That steak is for Dad. He will be home soon. You can have some soup and bread.""

Lily was sad. She did not like soup and bread. She liked steak. She was very hungry. She waited for Mom to go to the kitchen. Then she ran to the table. She grabbed the steak. She tried to bite it.

But the steak was hard. It was not cooked. Lily could not bite it. She tried to pull it. She used her teeth and her hands. She made a loud noise. She tore the steak.

Mom heard the noise. She came back to the table. She saw Lily with the steak. She saw the tear in the steak. She was angry. She said, ""Lily, what did you do? You tore the steak. That was very bad. You have to say sorry to Dad. And you have to go to your room. No more steak for you.""

Lily was sorry. She did not mean to tear the steak. She just wanted to eat it. She said sorry to Mom. She said sorry to Dad. She went to her room. She cried. She wished she had soup and bread.",0.2145,"Once upon a time, there was a gentle pumpkin. The pumpkin was so gentle that it made everyone happy when they saw it.

One day, somebody wanted to make something special with the gentle pumpkin. So they took it out of the garden and they poured some special stuff inside.

Then they added some extra ingredients and stirred it together. Everyone watched in amazement as the pumpkin was slowly transformed into something wonderful.

At the end of the day, the gentle pumpkin was now delicious pie. Everyone was delighted and enjoyed eating the special treat.

The gentle pumpkin had made everyone happy with its magic.",0.2129,"Anna and Ben were playing in the kitchen. They liked to pretend they were chefs and make yummy food. They found some celery in the fridge and decided to use it for their soup.

""Look, Ben, I have celery!"" Anna said, holding up a green stick.

""Me too, Anna!"" Ben said, grabbing another one. ""Celery is good for soup!""

They chopped the celery with their plastic knives and put it in a big pot. They added some water and salt and stirred it with a wooden spoon.

""Soup is ready!"" Anna announced, putting the pot on the table. ""Let's eat!""

They took two bowls and ladles and filled them with the celery soup. They blew on it to cool it down and tasted it.

""Yuck!"" Anna spat out the soup. ""This is not yummy! This is icky!""

""Yuck!"" Ben agreed, making a face. ""Celery is not good for soup! Celery is bad!""

They pushed their bowls away and looked at the pot. They still had a lot of celery soup left. What could they do with it?

""I know!"" Anna said, getting an idea. ""Let's destroy the celery soup!""

""Yeah!"" Ben said, liking the idea. ""Let's destroy it!""

They grabbed the pot and ran outside. They looked for a place to dump the celery soup. They saw a big hole in the ground where their dad was digging for a new flower bed.

""Perfect!"" Anna said, pointing at the hole. ""Let's put the celery soup there!""

They lifted the pot and poured the celery soup into the hole. The soup splashed and made a mess. They laughed and clapped their hands.

""We did it!"" Anna said, proud. ""We destroyed the celery soup!""

They heard a voice behind them. It was their dad. He looked at the hole and saw the celery soup. He looked at them and saw their smiles. He looked very sad.

""Anna, Ben, what did you do?"" he asked, softly. ""That was my flower bed. I was going to plant some roses there. Now it's ruined.""

Anna and Ben stopped laughing. They realized they had done something bad. They felt very sorry.

""Dad, we're sorry!"" Anna said, hugging him. ""We didn't know it was your flower bed. We thought it was just a hole.""

""We're sorry!"" Ben said, joining the hug. ""We didn't like the celery soup. We wanted to destroy it.""

Dad sighed and hugged them back. He was not angry, but he was still sad.

""I understand, kids,"" he said, gently. ""But you can't destroy things that are not yours. You have to be careful and respectful. And you have to try new foods. Celery is good for you. Maybe you'll like it better with some dip or cheese.""

Anna and Ben nodded. They felt bad for making their dad sad. They wanted to make him happy.

""Dad, can we help you fix your flower bed?"" Anna asked, hopefully.

""Dad, can we plant some roses with you?"" Ben asked, eagerly.

Dad smiled and wiped his eyes. He was happy to see their kindness.

""Sure, kids,"" he said, warmly. ""That would be very nice. Come on, let's go get some tools and seeds. And maybe some celery, too.""",0.2127
