text,label,new_story_1,new_story_1_score,new_story_2,new_story_2_score,new_story_3,new_story_3_score
"***[child's name] starting from 18 months had a lot [silence] he was a child who ate everything. He was a big fan of broccoli [silence] and from one day to the next decided that he would only eat pasta, ground beef, and green beans. But frozen, without butter, it couldn't be canned. Especially not fresh, without seasoning, no salt, so there you go. So we already started to question it with my husband, saying it's strange. Anything with a cake-like texture was out of the question. Anything like yogurt. A lot of eating disorders eventually. It always had to be the same thing, and when it wasn't, the plate would fly, he would scream, he would have huge tantrums.",Food selectivity,"Once upon a time, there was a little boy named Timmy. Timmy loved his mommy's meals, especially her spaghetti. One day, Timmy's mommy made him spaghetti for dinner, but she accidentally left it out for too long and it spoiled. Timmy didn't want to eat it, but his mommy said he had to.

""I don't want to eat it, mommy. It's spoiled,"" said Timmy.

""You have to eat it, Timmy. We don't waste food in this house,"" replied his mommy.

Timmy didn't want to upset his mommy, so he ate the spoiled spaghetti. After dinner, he went outside to play with his toys. He found a little bird that had died and he wanted to give it a proper burial.

""I found a bird, mommy. Can we bury it in the backyard?"" asked Timmy.

""Of course, Timmy. Let's go bury it,"" said his mommy.

Timmy and his mommy buried the bird in the backyard and Timmy felt better knowing the bird had a proper burial. He also learned that sometimes we have to do things we don't want to do, like eating spoiled meals, but it's important to not waste things and to always be kind to animals.",0.4711,"Once upon a time, there was a little boy. His name was Joe. Joe was 3 years old.

One morning, Joe was feeling very hungry. He wanted something to eat. He went to his mom and said: ""Mom, I want a waffle!""

His mom laughed. ""OK, Joe,"" she said. 

She took a clear plate out of the cupboard. She put a big waffle on the plate. Then she handed the plate to Joe.

Joe was very excited. He used a fork to remove the waffle from the plate. He munched on it happily.

The waffle made Joe so happy! He finished it in no time. 

""Thank you, Mom!"" he said with a huge smile on his face. 

His mom smiled back at him. ""You're welcome,"" she said. 

And they both lived happily ever after.",0.4324,"Once upon a time, there was a boy named Timmy. Timmy loved to whistle all day long. He would whistle while he played, while he ate, and even while he slept. One day, Timmy's mom made him some cookies. Timmy took a bite and said, ""Mom, these cookies don't taste regular. They taste funny."" His mom said, ""Timmy, I put a special ingredient in them. They are healthier for you.""

Timmy didn't like the taste of the cookies and he stopped whistling. He didn't want to eat anything that didn't taste regular. His mom explained to him that sometimes things that are good for us don't always taste the same as what we are used to. She reminded him that it's important to try new things and not always stick to the same old regular things.

From that day on, Timmy tried new foods and even started to like some of them. He also learned that just because something doesn't taste regular, it doesn't mean it's not good for you. He continued to whistle all day long, but now he did it with a smile on his face, knowing that he was trying new things and growing up to be a big boy.",0.4128
"***[child's name] at 18 months, started to refuse all foods [silence] not all foods but almost. So anything with chunks, whereas before I used to give him lots and lots of pieces of fruit. Since he was a child born in winter, I remember in the summer when he was 18 months old. I remember that summer, I would give him all the fruits possible. He ate everything. We were on vacation with friends, and suddenly he started to refuse everything. Absolutely everything. So we didn't understand why.",Food selectivity,"Once upon a time, there was a little boy named Timmy. Timmy had an old vest that he loved to wear. It was his favorite thing to wear because it kept him warm and cozy. 

One day, Timmy's mom told him that they were going to visit his grandma. Timmy didn't like visiting his grandma because she always made him eat vegetables, which he hated. 

Timmy put on his old vest and went to visit his grandma. She gave him a plate of vegetables to eat, but Timmy didn't like them at all. He told his grandma that he hated vegetables. 

After dinner, Timmy went back home and took off his old vest. He realized that even though he loved his vest, he hated vegetables even more. From that day on, Timmy promised himself that he would always eat his vegetables, even if he didn't like them.",0.4362,"Once upon a time, there was a little boy named Timmy. Timmy loved his mommy's meals, especially her spaghetti. One day, Timmy's mommy made him spaghetti for dinner, but she accidentally left it out for too long and it spoiled. Timmy didn't want to eat it, but his mommy said he had to.

""I don't want to eat it, mommy. It's spoiled,"" said Timmy.

""You have to eat it, Timmy. We don't waste food in this house,"" replied his mommy.

Timmy didn't want to upset his mommy, so he ate the spoiled spaghetti. After dinner, he went outside to play with his toys. He found a little bird that had died and he wanted to give it a proper burial.

""I found a bird, mommy. Can we bury it in the backyard?"" asked Timmy.

""Of course, Timmy. Let's go bury it,"" said his mommy.

Timmy and his mommy buried the bird in the backyard and Timmy felt better knowing the bird had a proper burial. He also learned that sometimes we have to do things we don't want to do, like eating spoiled meals, but it's important to not waste things and to always be kind to animals.",0.3989,"Once upon a time there was a boy named Jack. He loved candy and dreamed of having lots and lots of it. So one day he decided to make his own candy. He got out an old pot and filled it with sugar, milk, and butter. Then he stirred, stirred and stirred until it was all mixed up.

When he looked inside, he was so excited! There was a big pile of candy in the pot. He reached in to grab some and ate one of the candies. It was so yummy and sweet!

But when Jack ate the last of the candy, he heard a loud noise. Suddenly, a sleeping dragon flew out of the pot! Jack was scared and tried to run away, but the dragon was too fast!

The dragon said ""I was sleeping in the pot. You shouldn't have stirred my candy! Now I'm going to make you pay!"" Jack was very scared but he said bravely ""Please don't hurt me"". The dragon said ""OK, I won't hurt you if you promise never to stir my candy again"".

Jack promised not to stir the dragon's candy ever again and the dragon flew away. Jack was relieved and learned his lesson - stirring can be very dangerous!",0.3866
"Food is still very complicated. My daughter only eats meat. And no matter how much we try to cook for her, there's nothing we can do.",Food selectivity,"Lily was hungry. She wanted to eat steak. Steak was her favorite food. She saw a big steak on the table. It smelled good. She wanted to take it.

But Mom said, ""No, Lily. That steak is for Dad. He will be home soon. You can have some soup and bread.""

Lily was sad. She did not like soup and bread. She liked steak. She was very hungry. She waited for Mom to go to the kitchen. Then she ran to the table. She grabbed the steak. She tried to bite it.

But the steak was hard. It was not cooked. Lily could not bite it. She tried to pull it. She used her teeth and her hands. She made a loud noise. She tore the steak.

Mom heard the noise. She came back to the table. She saw Lily with the steak. She saw the tear in the steak. She was angry. She said, ""Lily, what did you do? You tore the steak. That was very bad. You have to say sorry to Dad. And you have to go to your room. No more steak for you.""

Lily was sorry. She did not mean to tear the steak. She just wanted to eat it. She said sorry to Mom. She said sorry to Dad. She went to her room. She cried. She wished she had soup and bread.",0.384,"Lily liked to help her mom in the kitchen. She wanted to be a famous cook like her mom. Her mom made yummy things like cakes and pies and soup. Lily wanted to make something too.

""Can I help you, mom?"" Lily asked.

""Sure, sweetie. You can help me make some pancakes. Do you know how to make pancakes?"" her mom said.

Lily nodded. She had seen her mom make pancakes many times. She knew you needed eggs and milk and flour and sugar and a pan.

""First, we need to crack the eggs and put them in a bowl. Can you do that?"" her mom said.

Lily took an egg and tapped it on the edge of the bowl. She tried to open it, but it was hard. She tapped it harder, and the egg broke. But it broke too much. The egg went everywhere. On the bowl, on the table, on the floor, on Lily.

""Oh no!"" Lily said.

""It's okay, honey. It's just an egg. We can clean it up. Here, take another egg and be gentle. Like this."" her mom showed her how to crack an egg and put it in the bowl.

Lily tried again. She cracked the egg and opened it. She put it in the bowl. She did it!

""Good job, Lily! Now we need to add the milk and the flour and the sugar and mix them well. Can you help me stir?"" her mom said.

Lily took a spoon and stirred the batter. She stirred and stirred and stirred. The batter became smooth and thick.

""Very good, Lily! Now we need to cook the pancakes. Can you help me pour the batter on the pan?"" her mom said.

Lily nodded. She took a ladle and scooped some batter. She poured it on the pan. She made a circle.

""Perfect, Lily! Now we need to wait until the pancake is ready to flip. Do you know how to tell when it's ready?"" her mom said.

Lily shook her head. She didn't know.

""Look at the pancake. Do you see the bubbles on the surface? When the bubbles pop, it means the pancake is ready to flip. Can you watch the bubbles?"" her mom said.

Lily watched the bubbles. She saw them pop. Pop, pop, pop.

""Mom, the bubbles are popping!"" Lily said.

""Good, Lily! Now we need to flip the pancake. Do you know how to flip a pancake?"" her mom said.

Lily shook her head. She didn't know.

""Watch me, Lily. I take a spatula and slide it under the pancake. Then I raise the pan and the spatula and flip the pancake in the air. Like this."" her mom flipped the pancake.

""Wow!"" Lily said.

""Can you try, Lily? It's fun. But be careful, the pan is hot."" her mom said.

Lily took the spatula and slid it under the pancake. She raised the pan and the spatula and flipped the pancake in the air. She did it!

""Yay!"" Lily said.

""Yay, Lily! You did it! You made a pancake! You are a famous cook!"" her mom said.

Lily smiled. She was happy. She made a pancake. She was a famous cook. She hugged her mom.

""I love you, mom. And I love pancakes."" Lily said.

""I love you too, Lily. And I love your pancakes. Let's make some more."" her mom said.

They made some more pancakes. They ate them with butter and syrup. They were delicious. Lily and her mom had a lot of fun in the kitchen. They were famous cooks.",0.3246,"Once upon a time, there was a little boy named Timmy. Timmy loved his mommy's meals, especially her spaghetti. One day, Timmy's mommy made him spaghetti for dinner, but she accidentally left it out for too long and it spoiled. Timmy didn't want to eat it, but his mommy said he had to.

""I don't want to eat it, mommy. It's spoiled,"" said Timmy.

""You have to eat it, Timmy. We don't waste food in this house,"" replied his mommy.

Timmy didn't want to upset his mommy, so he ate the spoiled spaghetti. After dinner, he went outside to play with his toys. He found a little bird that had died and he wanted to give it a proper burial.

""I found a bird, mommy. Can we bury it in the backyard?"" asked Timmy.

""Of course, Timmy. Let's go bury it,"" said his mommy.

Timmy and his mommy buried the bird in the backyard and Timmy felt better knowing the bird had a proper burial. He also learned that sometimes we have to do things we don't want to do, like eating spoiled meals, but it's important to not waste things and to always be kind to animals.",0.315
"Only meat. She only eats meat. Even as a baby, only meat. We were worried she would have deficiencies.",Food selectivity,"Lily was hungry. She wanted to eat steak. Steak was her favorite food. She saw a big steak on the table. It smelled good. She wanted to take it.

But Mom said, ""No, Lily. That steak is for Dad. He will be home soon. You can have some soup and bread.""

Lily was sad. She did not like soup and bread. She liked steak. She was very hungry. She waited for Mom to go to the kitchen. Then she ran to the table. She grabbed the steak. She tried to bite it.

But the steak was hard. It was not cooked. Lily could not bite it. She tried to pull it. She used her teeth and her hands. She made a loud noise. She tore the steak.

Mom heard the noise. She came back to the table. She saw Lily with the steak. She saw the tear in the steak. She was angry. She said, ""Lily, what did you do? You tore the steak. That was very bad. You have to say sorry to Dad. And you have to go to your room. No more steak for you.""

Lily was sorry. She did not mean to tear the steak. She just wanted to eat it. She said sorry to Mom. She said sorry to Dad. She went to her room. She cried. She wished she had soup and bread.",0.4805,"Tom and Lily were hungry. They wanted to eat beef for lunch. But when they opened the fridge, it was empty. There was no beef, no cheese, no milk, no eggs, nothing.

""Where is the beef?"" Tom asked. He blinked his eyes. He could not believe it.

""I don't know,"" Lily said. She blinked her eyes too. She was sad.

They heard a noise outside. They ran to the window. They saw a big truck. It had a picture of a cow on it. It said ""Beef Delivery"".

""Look, Tom, look!"" Lily shouted. ""The truck has beef!""

They ran to the door. They put on their shoes. They ran to the truck. They saw a man. He was wearing a hat and a apron. He was carrying a big box.

""Excuse me, sir,"" Tom said. ""Can we have some beef, please? Our fridge is empty. We are very hungry.""

The man smiled. He looked at Tom and Lily. They looked cute and polite.

""Sure, kids,"" he said. ""You can have some beef. But you have to ask your mom or dad first. Is that OK?""

Tom and Lily nodded. They ran back to the house. They found their mom. She was in the living room. She was reading a book.

""Mom, mom!"" they said. ""Can we have some beef, please? There is a truck outside. It has beef. The man said we can have some. Please, mom, please!""

Their mom looked surprised. She put down her book. She followed Tom and Lily outside. She saw the truck. She saw the man. She thanked him for his kindness. She took a box of beef. She paid him some money.

""Thank you, sir,"" she said. ""You made my kids very happy. And me too. We were out of food. You saved our lunch.""

The man waved goodbye. He drove away. Tom and Lily hugged their mom. They carried the box of beef inside. They helped their mom cook it. They ate it with bread and salad. It was delicious. They were full and happy. They blinked their eyes. They smiled.",0.4062,"Once upon a time, there was a little girl named Lily. She loved to play outside and explore the world around her. One day, as she was walking through the fields, she saw a yellow chicken pecking at the ground.

""Hello little chicken,"" said Lily. ""Why are you pecking at the ground?""

""I'm looking for food,"" said the chicken. ""I'm very hungry.""

Lily felt sorry for the chicken and decided to help. She went back to her house and got some seeds to feed the chicken. The chicken was very happy and started clapping its wings.

From that day on, Lily visited the chicken every day and brought it food. The chicken was always happy to see her and would clap its wings in excitement. One day, when Lily went to visit the chicken, she saw that it had laid an egg. The chicken was so proud and clapped its wings even harder. Lily was happy for the chicken and knew that it was all because she had helped it when it was hungry.",0.3497
"He is much more rigid with food. Right now, we're going through a very tough period. He has a lot of tantrums and is starting to refuse all foods without me knowing why.",Food selectivity,"Once upon a time, there was a little boy named Timmy. Timmy loved his mommy's meals, especially her spaghetti. One day, Timmy's mommy made him spaghetti for dinner, but she accidentally left it out for too long and it spoiled. Timmy didn't want to eat it, but his mommy said he had to.

""I don't want to eat it, mommy. It's spoiled,"" said Timmy.

""You have to eat it, Timmy. We don't waste food in this house,"" replied his mommy.

Timmy didn't want to upset his mommy, so he ate the spoiled spaghetti. After dinner, he went outside to play with his toys. He found a little bird that had died and he wanted to give it a proper burial.

""I found a bird, mommy. Can we bury it in the backyard?"" asked Timmy.

""Of course, Timmy. Let's go bury it,"" said his mommy.

Timmy and his mommy buried the bird in the backyard and Timmy felt better knowing the bird had a proper burial. He also learned that sometimes we have to do things we don't want to do, like eating spoiled meals, but it's important to not waste things and to always be kind to animals.",0.3037,"Once upon a time, a cute little dog named Max went to the store with his mom. They wanted to buy a tasty treat for Max. Max was very excited!

At the store, Max saw many treats. He asked his mom, ""Can I taste this one?"" His mom said, ""No, Max, that one has a high price. Let's find a treat that is not too pricey.""

Max looked around and found a treat that was not too pricey. He asked his mom, ""Can I taste this one?"" His mom said, ""Yes, Max, that one is a good price. Let's buy it and go home.""

When they got home, Max tasted the treat. It was very tasty! Max was happy, and his mom was happy too. They had a fun day at the store and enjoyed the tasty treat together.",0.263,"Once there was a grumpy man. He was so grumpy that he never wanted to do anything. He did not like to play or do anything fun.

One day the man was very hungry. He saw soup and wanted to eat it. But when he tried to eat it, it was too hot! So he quit.

The man was even grumpier now. He stomped around and refused to eat the soup. He was angry because he was so hungry.

Suddenly, he heard a voice. The voice asked him, ""Why'd you quit?""ï»¿

The man didn't know what to say. He felt embarrassed. He explained to the voice that the soup was too hot.

The voice said, ""I can help you with that. Just wait a second."" Then the voice came back with a cooler bowl of soup.

The grumpy man tried it and found that it was just right! He ate the soup and felt much better. He even thanked the voice before he left. 

The voice said, ""You're welcome! Just remember, don't quit next time.""",0.2516
"When he sees me preparing the meal, he asks to go to bed. With tears in his eyes, he says ""bed."" He sits down. He either tastes or doesn't taste the plate. He starts to cry and tells me he's not hungry and doesn't want to eat the things he used to eat. He refuses vegetables. He could eat desserts and bottles, but we really insist on keeping the vegetables mashed with a fork with oil and butter. And with a little bit of protein. These are things he has been eating non-stop for two years.",Food selectivity,"Once upon a time, there was a little boy named Timmy. Timmy loved his mommy's meals, especially her spaghetti. One day, Timmy's mommy made him spaghetti for dinner, but she accidentally left it out for too long and it spoiled. Timmy didn't want to eat it, but his mommy said he had to.

""I don't want to eat it, mommy. It's spoiled,"" said Timmy.

""You have to eat it, Timmy. We don't waste food in this house,"" replied his mommy.

Timmy didn't want to upset his mommy, so he ate the spoiled spaghetti. After dinner, he went outside to play with his toys. He found a little bird that had died and he wanted to give it a proper burial.

""I found a bird, mommy. Can we bury it in the backyard?"" asked Timmy.

""Of course, Timmy. Let's go bury it,"" said his mommy.

Timmy and his mommy buried the bird in the backyard and Timmy felt better knowing the bird had a proper burial. He also learned that sometimes we have to do things we don't want to do, like eating spoiled meals, but it's important to not waste things and to always be kind to animals.",0.3733,"Once upon a time, there was a little boy named Timmy. Timmy had an old vest that he loved to wear. It was his favorite thing to wear because it kept him warm and cozy. 

One day, Timmy's mom told him that they were going to visit his grandma. Timmy didn't like visiting his grandma because she always made him eat vegetables, which he hated. 

Timmy put on his old vest and went to visit his grandma. She gave him a plate of vegetables to eat, but Timmy didn't like them at all. He told his grandma that he hated vegetables. 

After dinner, Timmy went back home and took off his old vest. He realized that even though he loved his vest, he hated vegetables even more. From that day on, Timmy promised himself that he would always eat his vegetables, even if he didn't like them.",0.3658,"Lily was hungry. She wanted to eat steak. Steak was her favorite food. She saw a big steak on the table. It smelled good. She wanted to take it.

But Mom said, ""No, Lily. That steak is for Dad. He will be home soon. You can have some soup and bread.""

Lily was sad. She did not like soup and bread. She liked steak. She was very hungry. She waited for Mom to go to the kitchen. Then she ran to the table. She grabbed the steak. She tried to bite it.

But the steak was hard. It was not cooked. Lily could not bite it. She tried to pull it. She used her teeth and her hands. She made a loud noise. She tore the steak.

Mom heard the noise. She came back to the table. She saw Lily with the steak. She saw the tear in the steak. She was angry. She said, ""Lily, what did you do? You tore the steak. That was very bad. You have to say sorry to Dad. And you have to go to your room. No more steak for you.""

Lily was sorry. She did not mean to tear the steak. She just wanted to eat it. She said sorry to Mom. She said sorry to Dad. She went to her room. She cried. She wished she had soup and bread.",0.359
